{
  "$schema": "https://json-schema.org/draft/2020-12/schema",
  "$id": "https://epistemic-lens/api/schema/long.schema.json",
  "title": "Draft long-form post (LinkedIn / Substack / Newsletter)",
  "description": "Long-form prose draft generated by the daily draft_long job. body_md is markdown; sources are cited inline as [bucket](url). The frontend renders body_md and uses the sources[] array for an appendix or hover-citations.",
  "type": "object",
  "required": ["story_key", "date", "title", "body_md", "sources"],
  "additionalProperties": false,
  "properties": {
    "meta_version": {
      "type": "string",
      "description": "Methodology pin version this draft was produced under (added by meta.stamp())."
    },
    "story_key": {
      "type": "string"
    },
    "date": {
      "type": "string",
      "pattern": "^\\d{4}-\\d{2}-\\d{2}$"
    },
    "title": {
      "type": "string",
      "description": "Post title. Recommended <= 90 chars."
    },
    "subtitle": {
      "type": "string",
      "description": "Optional dek / subtitle."
    },
    "body_md": {
      "type": "string",
      "minLength": 200,
      "description": "Markdown body. Verbatim quotes wrapped in > or \"...\". All factual claims cite a source from the sources[] array."
    },
    "sources": {
      "type": "array",
      "minItems": 1,
      "description": "All sources referenced in body_md. Frontend may render as appendix or hover-citations.",
      "items": {
        "type": "object",
        "required": ["bucket", "url"],
        "additionalProperties": false,
        "properties": {
          "bucket": {"type": "string"},
          "url": {"type": "string", "format": "uri"},
          "outlet": {"type": "string"}
        }
      }
    },
    "tags": {
      "type": "array",
      "items": {"type": "string"},
      "description": "Free-text tags (e.g. ['middle-east', 'framing-analysis'])."
    },
    "generated_at": {
      "type": "string",
      "format": "date-time"
    },
    "model": {
      "type": "string"
    }
  }
}
