{
  "meta_version": "10.0.3",
  "story_key": "Le43bd35eb2",
  "date": "2026-08-19",
  "title": "Trump Said Deal. Carney Said Postponement. Twenty-Four Outlets Shrugged.",
  "subtitle": "The Canada tariff pause masked a negotiating chasm that only one outlet reported fully",
  "body_md": "At midnight on August 19, with fifty percent tariffs set to trigger on twenty billion dollars of Canadian imports, Trump posted \"DEAL!\" on Truth Social. One hour later, [CBC World](https://www.cbc.ca/news/politics/new-trump-tariffs-deadline-9.7311125?cmp=rss) reported that Prime Minister Mark Carney \"did not speak of a tentative deal and did not say which concessions might have been made\" and \"characterized the administration's decision as a postponement so trade discussions can continue.\" The same event. Opposite characterizations. Twenty-four global outlets across fifteen countries largely treated both as routine news and left the contradiction unremarked.\n\nFrance, which is simultaneously involved in EU-US trade negotiations on a parallel track, produced no coverage in this cluster — an absence that underscores how thoroughly North American bilateral trade operates in a media silo separate from European trade diplomacy, even when the same US tariff logic applies to both. Continental Europe appeared only through Germany.\n\nThe semantic split was not cosmetic. It reflected a genuine gap between what each side claimed to have agreed. [Al Jazeera English](https://www.aljazeera.com/economy/2026/8/19/us-canada-reach-trade-deal-to-avert-steep-tariffs-trump-says?traffic_source=rss) reported that \"Washington and Ottawa announce agreement to delay new tariffs on Canadian exports shortly before midnight deadline\" without parsing whether delay and deal are the same thing. [Axios World](https://www.axios.com/2026/08/19/trump-canada-tariffs-50-percent-postponed) described \"an intense push in recent days — including talks between Trump and Canadian Prime Minister Mark Carney on Tuesday — to avert another escalation in the North American trade war.\" [Channel News Asia](https://www.channelnewsasia.com/world/us-canada-strike-deal-temporarily-pause-50-percent-tariffs-donald-trump-6327471) noted businesses had warned that the fees \"would have affected about US$20 billion worth of Canadian imports\" and that industries including \"lumber, wine and dairy\" faced \"job losses and disruption.\" The business-impact framing was common; the semantic-split framing was rare.\n\n[Globe and Mail](https://www.theglobeandmail.com/world/us-politics/article/trump-pauses-new-tariffs-for-three-days-says-us-canada-have-reached/) was the single outlet to reveal the scope of US demands underlying the claimed deal: F-35 jet purchases from Lockheed Martin, Golden Dome radar planes, critical-minerals right-of-first-refusal, dairy supply-management changes, provincial liquor access, and Keystone XL. That is a demand list extending into defense procurement, energy infrastructure, and agricultural trade architecture — a far broader agenda than most other outlets conveyed. In exchange, Trump \"demanded a long list of concessions from Canada, including that Ottawa drop its retaliatory tariffs on American autos, change how licences are allocated under the dairy supply-management system and instruct provincial governments to return U.S. alcohol to store shelves.\" No other outlet in fifteen countries reported the full scope.\n\n[The Guardian World](https://www.theguardian.com/us-news/2026/aug/19/trump-delay-canada-tariffs-keystone-xl-oil-pipeline) headlined the Keystone XL angle, bundling the tariff pause with contested fossil-fuel infrastructure in a way most outlets buried or omitted. [Republic World (alt)](https://www.republicworld.com/world-news/trump-says-us-and-canada-have-reached-last-minute-deal-to-delay-50-us-tariffs-on-canadian-imports-2026-08-19-135042) was alone in linking the tariff pause to November US midterm elections, noting US voters were \"already frustrated with the high cost of living\" as a domestic constraint on Trump's willingness to escalate. The midterm-pressure frame — Trump as political actor managing tariff theater before an electoral constraint — appeared nowhere else in the corpus.\n\nThe LaBSE isolation scores tell a complementary story: Southeast Asian and Pakistani outlets sat at the periphery of the coverage cluster (mean similarities of 0.701 and 0.742 respectively), providing brief summaries with minimal overlap with the detailed concession reporting from North American and UK outlets. Nigerian outlet Vanguard, the furthest from the cluster centroid, reported the pause in a single brief paragraph without any Canada-US political context.\n\n[Times of India](https://timesofindia.indiatimes.com/business/international-business/us-canada-tariff-row-eases-trump-pauses-50-levies-after-last-minute-deal/articleshow/133335629.cms) noted the tariffs \"would have impacted approximately five percent of Canadian exports to the US\" — a figure that frames the immediate stakes as real but bounded. The three-day pause expiring August 21 means the Globe's reporting on the full demand list — defense procurement, pipeline infrastructure, dairy architecture — reveals what Carney's \"important work still to be done\" actually refers to: the gap between a pause and a deal is as wide as the distance between Trump's declared victory and the concessions Canada had not yet agreed to make.",
  "sources": [
    {
      "bucket": "canada",
      "url": "https://www.cbc.ca/news/politics/new-trump-tariffs-deadline-9.7311125?cmp=rss",
      "outlet": "CBC World"
    },
    {
      "bucket": "qatar",
      "url": "https://www.aljazeera.com/economy/2026/8/19/us-canada-reach-trade-deal-to-avert-steep-tariffs-trump-says?traffic_source=rss",
      "outlet": "Al Jazeera English"
    },
    {
      "bucket": "usa",
      "url": "https://www.axios.com/2026/08/19/trump-canada-tariffs-50-percent-postponed",
      "outlet": "Axios World"
    },
    {
      "bucket": "vietnam_thai_my",
      "url": "https://www.channelnewsasia.com/world/us-canada-strike-deal-temporarily-pause-50-percent-tariffs-donald-trump-6327471",
      "outlet": "Channel News Asia"
    },
    {
      "bucket": "canada",
      "url": "https://www.theglobeandmail.com/world/us-politics/article/trump-pauses-new-tariffs-for-three-days-says-us-canada-have-reached/",
      "outlet": "Globe and Mail"
    },
    {
      "bucket": "uk",
      "url": "https://www.theguardian.com/us-news/2026/aug/19/trump-delay-canada-tariffs-keystone-xl-oil-pipeline",
      "outlet": "The Guardian World"
    },
    {
      "bucket": "india",
      "url": "https://www.republicworld.com/world-news/trump-says-us-and-canada-have-reached-last-minute-deal-to-delay-50-us-tariffs-on-canadian-imports-2026-08-19-135042",
      "outlet": "Republic World (alt)"
    },
    {
      "bucket": "india",
      "url": "https://timesofindia.indiatimes.com/business/international-business/us-canada-tariff-row-eases-trump-pauses-50-levies-after-last-minute-deal/articleshow/133335629.cms",
      "outlet": "Times of India"
    }
  ],
  "tags": [
    "canada",
    "tariffs",
    "trump",
    "trade",
    "framing-analysis"
  ],
  "generated_at": "2026-08-22T00:00:00Z",
  "model": "claude-sonnet-4-6"
}