{
  "meta_version": "10.0.3",
  "story_key": "L55b8663307",
  "date": "2026-06-19",
  "title": "Celebration, Crime Scene, Political Liability",
  "subtitle": "The same afternoon in New York produced three incompatible stories depending on where you read.",
  "body_md": "The New York Knicks held their first NBA championship parade in 53 years through Manhattan on June 19. Shortly after it ended, shots were fired near Times Square at approximately 3:40 pm, injuring one person. A juvenile suspect was arrested; officials described the incident as stemming from a dispute, not a random attack. Fifteen outlets across 10 countries covered both events — and produced three incompatible stories from the same afternoon.\n\n[The New Yorker](https://www.newyorker.com/news/our-local-correspondents/the-knicks-championship-win-transforms-the-city) treated the championship as urban transformation: \"A joyous parade up the Canyon of Heroes proved a fitting celebration.\" [AFP / France 24](https://www.france24.com/en/world-cup-not-today-new-york-is-celebrating-the-knicks) and [CBC World](https://www.cbc.ca/sports/in-photos-knicks-championship-celebration-9.7239921?cmp=rss) reported the civic event: tens of thousands packed Manhattan for the Knicks' first title since 1973. [The Independent](https://www.independent.co.uk/news/world/americas/knicks-parade-time-route-new-york-ticker-tape-b2998386.html) covered the infrastructure strain — viewing areas filled to capacity, fans chanting to be let in.\n\nThree Indian outlets, BFM TV (France), and Russia's [RT](https://www.rt.com/news/641807-shooting-panic-times-square/?utm_source=rss&utm_medium=rss&utm_campaign=RSS) led with the shooting instead. RT uniquely headlined the word \"panic\" — using the Times Square incident as an American-disorder narrative with no parade context. [Republic World](https://www.republicworld.com/world-news/shots-fired-in-new-york-s-times-square-trigger-panic-one-injured-juvenile-suspect-held-2026-06-19-128986) provided the most factually specific account: one injured, juvenile suspect arrested, incident stemmed from a dispute not a random attack. VnExpress (Vietnam) led with \"smashed vehicles, littered streets\" and fans descending into \"disorder\" — the most sensationalized framing in the corpus, treating post-championship fan activity as near-riot.\n\nUS conservative outlets — [Daily Wire](https://www.dailywire.com/news/mamdanis-office-makes-embarrassing-mistake-for-knicks-championship-parade) and [Daily Caller](https://dailycaller.com/2026/06/19/new-york-knicks-james-dolan-zohrah-mamdani-nba-championship/) — produced a third version: neither the celebration nor the crime, but Mayor Zohran Mamdani's administration making an \"embarrassing mistake\" on player banners, and Knicks owner James Dolan appearing to take a jab at the mayor during the ceremony. No mention of the shooting in either outlet. [Breitbart](https://www.breitbart.com/sports/2026/06/18/watch-knicks-players-mistaken-for-fan-by-police-nearly-arrested/) centered the Tyler Kolek police detention during the parade — a right-populist US outlet foregrounding police-player confusion without naming race as a factor.\n\nThe editorial divergence tracks predictably: civic-celebration coverage in Western wire services and US-adjacent outlets; crime-and-disorder coverage in non-Western and Russian media; political-failure coverage in the US conservative press. The same afternoon, the same city, the same two events. The editorial choices visible in this corpus reflect what each outlet thinks its audience will find significant about New York — not what happened in the five-hour window between parade start and shooting.\n\nThe structure is worth naming. RT has a documented pattern of amplifying American disorder stories; the Times Square shooting provided an occasion. US conservative outlets have a documented pattern of using municipal events as vehicles for criticizing Democratic administrations; the banner errors and owner-mayor friction provided the content. The New Yorker has a documented commitment to civic meaning-making around New York institutions; the Knicks championship provided the material. Each outlet produced its expected story. None of them covered the same event.",
  "sources": [
    {"bucket": "wire_services", "url": "https://www.france24.com/en/world-cup-not-today-new-york-is-celebrating-the-knicks", "outlet": "AFP / France 24 EN"},
    {"bucket": "usa", "url": "https://www.breitbart.com/sports/2026/06/18/watch-knicks-players-mistaken-for-fan-by-police-nearly-arrested/", "outlet": "Breitbart"},
    {"bucket": "canada", "url": "https://www.cbc.ca/sports/in-photos-knicks-championship-celebration-9.7239921?cmp=rss", "outlet": "CBC World"},
    {"bucket": "usa", "url": "https://dailycaller.com/2026/06/19/new-york-knicks-james-dolan-zohrah-mamdani-nba-championship/", "outlet": "Daily Caller"},
    {"bucket": "usa", "url": "https://www.dailywire.com/news/mamdanis-office-makes-embarrassing-mistake-for-knicks-championship-parade", "outlet": "Daily Wire"},
    {"bucket": "russia", "url": "https://www.rt.com/news/641807-shooting-panic-times-square/?utm_source=rss&utm_medium=rss&utm_campaign=RSS", "outlet": "RT"},
    {"bucket": "india", "url": "https://www.republicworld.com/world-news/shots-fired-in-new-york-s-times-square-trigger-panic-one-injured-juvenile-suspect-held-2026-06-19-128986", "outlet": "Republic World"},
    {"bucket": "uk", "url": "https://www.independent.co.uk/news/world/americas/knicks-parade-time-route-new-york-ticker-tape-b2998386.html", "outlet": "The Independent"},
    {"bucket": "opinion_magazines", "url": "https://www.newyorker.com/news/our-local-correspondents/the-knicks-championship-win-transforms-the-city", "outlet": "The New Yorker"}
  ],
  "tags": ["knicks", "nba", "new-york", "framing-analysis", "times-square"],
  "generated_at": "2026-06-21T00:00:00Z",
  "model": "claude-sonnet-4-6"
}
