{
  "meta_version": "10.0.3",
  "story_key": "Lcb19cb8153",
  "date": "2026-09-01",
  "title": "Fox News and The Guardian Agreed on Russia's Strategy. Almost Nobody Reported the Consequence.",
  "subtitle": "Six nights of strikes on Kyiv, 12 dead, and the under-reported story: Ukraine is running out of the interceptors that can stop the missiles.",
  "body_md": "Russia struck Kyiv for the sixth consecutive night on September 1, killing at least 12 people including six railway workers at a depot hit by ballistic missiles. Odesa was also targeted. Ukraine struck back: [Meduza](https://meduza.io/en/news/2026/08/31/ukrainian-drones-attack-russia-s-yekaterinburg-three-apartment-buildings-damaged-four-people-injured) — the only outlet in the corpus to report it — noted Ukrainian drones struck Yekaterinburg in Russia's Ural region, damaging apartment buildings deep inside Russian territory.\n\nTwenty-six outlets across 15 countries covered the sixth-night barrage. Their factual framing was nearly identical. The question they diverged on was which secondary fact to lead with — and one secondary fact, surfaced by only a handful of Western outlets, is more consequential than the others.\n\n[BBC World](https://www.bbc.co.uk/news/articles/cx2zmdgry3do?at_medium=RSS&at_campaign=rss) described Russia's bombardment as what \"appears to be a strategy aimed at exhausting Ukrainian air defences and undermining civilian morale.\" [Fox News](https://www.foxnews.com/world/putin-unleashes-new-fury-ukraine-report-exposes-fear-hanging-over-wars-end) anchored on \"fear hanging over war's end\" — framing Russia's drone volume through the lens of US war-termination anxiety. Both outlets, from opposite ends of the US editorial spectrum, attributed Russia's strategy to the same objective: exhausting Ukrainian capacity to intercept. [The Guardian](https://www.theguardian.com/world/2026/sep/01/russia-kills-sixth-night-drone-attacks-ukraine-kyiv) reported \"Zelenskyy says Moscow is capitalising on shortage of US-made Patriot interceptors to lower morale in capital.\"\n\nThe shortage they are collectively describing is the story most of the corpus missed. [CBC World](https://www.cbc.ca/news/world/russia-air-ukraine-kyiv-strikes-9.7327653?cmp=rss) reported Ukraine is \"critically low on the US-made Patriot interceptors capable of stopping Russia's ballistic missiles\" and that Zelensky urged allies to provide more. The Patriot depletion is happening simultaneously with a qualitative shift in Russian weapons: [CBC World](https://www.cbc.ca/news/world/russia-air-ukraine-kyiv-strikes-9.7327653?cmp=rss) noted Russia is deploying \"newer versions, powered by jet engines, making them harder to intercept.\" Faster drones, fewer interceptors. The interaction between those two trends was flagged by only a handful of Western outlets and was absent from all Global South coverage.\n\n[Al Jazeera English](https://www.aljazeera.com/news/2026/9/1/russian-drone-and-missile-barrage-kills-at-least-12-in-ukraines-kyiv?traffic_source=rss) was the only outlet to link the overnight barrage to a simultaneous EU defense ministers' meeting in Ireland on Ukraine air defense shortages — connecting the tactical event to the institutional moment. [NPR World](https://www.npr.org/2026/08/31/g-s1-141181/russia-ukraine-war) uniquely grounded the story in civilian supply chain: \"empty supermarket shelves after repeated strikes on warehouses\" — a consumer-experience dimension absent from military and diplomatic framing. [Globe and Mail](https://www.theglobeandmail.com/world/article-russian-air-attacks-kyiv-region-ukraine/) was the only outlet to include survivor testimony, quoting a Boryspil resident describing the crater outside his building.\n\n[The Independent](https://www.independent.co.uk/news/world/europe/russia-ukraine-drone-attack-kyiv-war-b3042557.html) introduced a framing none of the other 25 outlets adopted: it positioned Russia's strikes as \"retaliation against Kyiv's sustained deep strike campaign on Russian infrastructure\" — a symmetry narrative that inverts the cause-and-effect sequence present in most Western coverage. India's three outlets (The Hindu, Hindustan Times, Republic World) all foregrounded a nationally specific story: an Indian national was among the 12 killed, with Zelensky's condolence statement becoming the lead angle in Indian coverage.\n\nPoland — a NATO border state hosting millions of Ukrainian refugees and a primary transit country for Western military aid — does not appear in the corpus. China, whose state media typically frames the conflict through a Western-aggression lens, is also absent. The absence of both means neither the frontline NATO perspective nor the competing geopolitical frame from Beijing appear alongside 26 outlets that largely track each other's wire-driven coverage.\n\nThe operational fact underneath the journalism is that Ukraine's air-defense capacity is being ground down by design, at exactly the moment when the weapons being deployed against it are getting harder to stop. That observation was available in the corpus. It needed more than a handful of outlets to report it.",
  "sources": [
    {"bucket": "russia", "url": "https://meduza.io/en/news/2026/08/31/ukrainian-drones-attack-russia-s-yekaterinburg-three-apartment-buildings-damaged-four-people-injured", "outlet": "Meduza"},
    {"bucket": "uk", "url": "https://www.bbc.co.uk/news/articles/cx2zmdgry3do?at_medium=RSS&at_campaign=rss", "outlet": "BBC World"},
    {"bucket": "usa", "url": "https://www.foxnews.com/world/putin-unleashes-new-fury-ukraine-report-exposes-fear-hanging-over-wars-end", "outlet": "Fox News World"},
    {"bucket": "uk", "url": "https://www.theguardian.com/world/2026/sep/01/russia-kills-sixth-night-drone-attacks-ukraine-kyiv", "outlet": "The Guardian World"},
    {"bucket": "canada", "url": "https://www.cbc.ca/news/world/russia-air-ukraine-kyiv-strikes-9.7327653?cmp=rss", "outlet": "CBC World"},
    {"bucket": "qatar", "url": "https://www.aljazeera.com/news/2026/9/1/russian-drone-and-missile-barrage-kills-at-least-12-in-ukraines-kyiv?traffic_source=rss", "outlet": "Al Jazeera English"},
    {"bucket": "usa", "url": "https://www.npr.org/2026/08/31/g-s1-141181/russia-ukraine-war", "outlet": "NPR World"},
    {"bucket": "canada", "url": "https://www.theglobeandmail.com/world/article-russian-air-attacks-kyiv-region-ukraine/", "outlet": "Globe and Mail"},
    {"bucket": "uk", "url": "https://www.independent.co.uk/news/world/europe/russia-ukraine-drone-attack-kyiv-war-b3042557.html", "outlet": "The Independent"}
  ],
  "tags": ["ukraine", "russia", "kyiv", "air-defense", "war-coverage", "framing-analysis"],
  "generated_at": "2026-09-02T00:25:00Z",
  "model": "claude-sonnet-4-6"
}
