{
  "meta_version": "10.0.3",
  "story_key": "L0fdef4c999",
  "date": "2026-06-19",
  "title": "211 Deaths and a Disputed Evidentiary Standard",
  "subtitle": "The cumulative body count traveled universally. The question of who decides guilt at sea did not.",
  "body_md": "The US military struck a boat in the eastern Pacific on June 19, killing three men aboard. The Trump administration called the vessel a drug-trafficking operation. It was the latest in a campaign that began in September 2025 and has since killed at least 211 people in similar boat strikes. [NPR](https://www.npr.org/2026/06/19/nx-s1-5864084/us-strike-alleged-drug-boat-kills-3-eastern-pacific-ocean) reported: \"The latest attack brings the number of people who have been killed in boat strikes by the U.S. military to at least 211 since the Trump administration began targeting those it calls 'narcoterrorists' in early September.\" That number — 211 — appeared across outlets from right-populist Indian press to Canadian wire, giving a routine tactical event the accumulated weight of a campaign casualty count.\n\nTen outlets across 10 countries covered the story. The dominant frame was counter-narcotics enforcement: [AP News](https://apnews.com/article/boat-strikes-drug-trafficking-us-military-f224cc4a878aa0f61b914b2b43b66c0b) defined it as \"the Trump administration wag[ing] a months-long campaign against alleged traffickers in Latin America.\" [Al Jazeera](https://www.aljazeera.com/news/2026/6/19/us-kills-3-in-strike-on-alleged-drug-smuggling-boat-in-eastern-pacific?traffic_source=rss) placed \"narco-terrorists\" in scare quotes and attributed the label solely to Washington — the most explicit English-language editorial distancing from the US justification in the corpus. [The Guardian](https://www.theguardian.com/us-news/2026/jun/18/us-military-boat-strike-pacific-ocean) matched AP's language closely.\n\nTwo outlets broke from the campaign framing to question evidentiary basis. [Straits Times](https://www.straitstimes.com/world/us-military-says-three-killed-in-its-strike-on-vessel-in-eastern-pacific) — a Western-aligned Singapore establishment outlet — noted that \"human rights groups call [such attacks] extrajudicial killings\" alongside Washington's \"narco-terrorist\" characterization, lending that critique institutional visibility beyond explicitly critical-of-West outlets. Mexico's [La Jornada](https://www.jornada.com.mx/2026/06/19/mundo/023n3mun?partner=rss) went further: using \"ejecuta\"/\"asesinó\" (executes/murdered) and calling the vessel \"señalada sin pruebas\" — accused without evidence — it was the only outlet to explicitly dispute whether the target had been proven to be involved in drug trafficking before being struck.\n\n[Globe and Mail](https://www.theglobeandmail.com/world/us-politics/article/us-military-strike-boat-pacific-ocean/) reported only the bare facts and the 211 count, without using \"narco-terrorist\" language at all — the most stripped-down neutral framing from a non-wire outlet. One Serbian outlet in the corpus published its signal text entirely in Serbian/Bosnian despite its English branding, indicating its \"English\" designation reflects a CNN affiliate relationship rather than output language.\n\nThe eastern Pacific strike corridor is the primary export route for Colombian drug operations. US Southern Command operations in this area most directly implicate Colombian-linked trafficking networks. No Colombian or broader South American outlet appeared in this 10-country corpus. The region most directly affected by these operations had no voice.\n\nWhether a vessel \"accused\" of drug trafficking by US military intelligence constitutes a legitimate strike target — without trial, judicial review, or independent verification — is the question that distinguishes La Jornada's \"sin pruebas\" from AP's \"accused of smuggling.\" At 211 deaths since September, it is no longer a procedural question about individual incidents. It is a question about a policy. The Straits Times introduced the human rights framing and then left it; La Jornada made it the centre. No other outlet in this 10-country corpus asked it at all.",
  "sources": [
    {"bucket": "wire_services", "url": "https://apnews.com/article/boat-strikes-drug-trafficking-us-military-f224cc4a878aa0f61b914b2b43b66c0b", "outlet": "AP News"},
    {"bucket": "qatar", "url": "https://www.aljazeera.com/news/2026/6/19/us-kills-3-in-strike-on-alleged-drug-smuggling-boat-in-eastern-pacific?traffic_source=rss", "outlet": "Al Jazeera English"},
    {"bucket": "canada", "url": "https://www.theglobeandmail.com/world/us-politics/article/us-military-strike-boat-pacific-ocean/", "outlet": "Globe and Mail"},
    {"bucket": "mexico", "url": "https://www.jornada.com.mx/2026/06/19/mundo/023n3mun?partner=rss", "outlet": "La Jornada"},
    {"bucket": "usa", "url": "https://www.npr.org/2026/06/19/nx-s1-5864084/us-strike-alleged-drug-boat-kills-3-eastern-pacific-ocean", "outlet": "NPR World"},
    {"bucket": "vietnam_thai_my", "url": "https://www.straitstimes.com/world/us-military-says-three-killed-in-its-strike-on-vessel-in-eastern-pacific", "outlet": "Straits Times"},
    {"bucket": "uk", "url": "https://www.theguardian.com/us-news/2026/jun/18/us-military-boat-strike-pacific-ocean", "outlet": "The Guardian World"}
  ],
  "tags": ["drug-war", "us-military", "latin-america", "counter-narcotics", "framing-analysis"],
  "generated_at": "2026-06-21T00:00:00Z",
  "model": "claude-sonnet-4-6"
}
