{
  "meta_version": "10.0.3",
  "story_key": "L1b2d961550",
  "date": "2026-07-21",
  "title": "When Fidesz and Amnesty International Agree",
  "subtitle": "Hungary's post-Orbán gambit fails — and its critics come from every direction",
  "body_md": "Chess grandmaster Judit Polgár declined Hungary's presidency on July 20, and what the international press made of that refusal reveals something precise about the state of the Magyar government's legitimacy project. Polgár said she did not \"feel enough strength within me to take on the historic responsibility\" of the role, as reported by both [Haaretz](https://www.haaretz.com/world-news/europe/2026-07-21/ty-article/jewish-hungarian-chess-legend-judit-polgar-turns-down-offer-for-presidency/0000019f-838d-d490-a59f-a7fdeb780000) and [The Guardian](https://www.theguardian.com/world/2026/jul/20/peter-magyar-judit-polgar-president-hungary-chess-prodigy-strategic-move). The formula could read as graceful self-deprecation. In context, it reads as a veto.\n\nThe analytical finding that makes this corpus unusually useful is a paradox: pro-Fidesz outlet Hungary Today and human-rights watchdog Amnesty International — cited by [Balkan Insight](https://balkaninsight.com/2026/07/21/hungarian-pms-presidential-gambit-fails-as-polgar-declines-nomination/rd/) — independently arrived at the same critique of Magyar's approach from opposite political directions. Hungary Today framed Magyar as an \"autocratic leader\" who had left himself \"red-faced\" with a clumsy, rushed gambit; Amnesty International's position, as reported by Balkan Insight, was that \"the selection of Hungary's next president should not be rushed, Peter Magyar is acting as if there were no time for a meaningful consultation.\" Fidesz media and the democratic accountability watchdog both concluded: this was botched. One condemns Magyar for being insufficiently loyal to Hungary's pre-Magyar order; the other for failing to live up to the democratic reform he ran on. The shared surface — rushed, poorly managed, non-deliberative — emerges from opposite premises.\n\nThe broader corpus — 10 countries in a relatively small cluster — treated the story primarily through the cultural frame of Polgár's stature. [South China Morning Post](https://www.scmp.com/news/world/europe/article/3361262/chess-champion-judit-polgar-rejects-offer-become-hungarys-president) described her as \"widely considered the greatest female chess player of all time.\" [Globe and Mail](https://www.theglobeandmail.com/world/article-hungary-pm-magyar-president-chess-judit-polgar/) noted that Polgár \"would represent a break with the Orbán-era's nationalist culture.\" [CGTN](https://news.cgtn.com/news/2026-07-20/Hungarian-PM-taps-chess-grandmaster-Judit-Polgar-to-serve-as-president-1OWjF3Rob8Q/p.html) covered the offer without editorializing on the rejection, consistent with Chinese state media's pattern of treating European domestic politics as administrative fact. The framing that cuts against the grain came from [Haaretz](https://www.haaretz.com/world-news/europe/2026-07-20/ty-article/hungarys-pm-magyar-to-offer-presidency-to-jewish-chess-legend-judit-polgar/0000019f-7f81-d48b-ab9f-7faf12610000), which foregrounded Polgár's Jewish identity as a politically significant dimension of the offer — making explicit what most outlets treated as background: that offering the presidency to a Jewish Hungarian in the aftermath of an Orbán-era marked by antisemitic undertones carried a specific symbolic weight that Magyar was trying to mobilise and that Polgár declined to carry.\n\nThe silence with the most structural weight is Russian state media's complete absence from this cluster. TASS, RT, and other Kremlin outlets ran nothing on a story that directly concerns Hungary's pivot away from the Orbán relationship with Moscow and its trajectory toward full EU alignment. The story signals post-Orbán realignment in the most explicit possible way — Polgár's presidency would have represented a sharp break with the cultural nationalism that made Hungary a reliable Kremlin sympathiser within the EU. Russian media's silence on a story this directly threatening to its regional influence suggests either editorial calculation that amplifying Magyar's struggles is more useful than covering the substance of the pivot, or a genuine editorial blackout on Hungarian political evolution. The cluster does not resolve which.\n\nWhat the rejection leaves behind is a vacancy — literal and political. Hungary's presidency remains unfilled, Magyar's first major leadership gambit has failed publicly, and the constitutional removal of his predecessor Sulyok — who required a formal amendment to dislodge — has already drawn criticism as institutional overreach from both sides of the political spectrum. Whether Magyar can find a candidate whose acceptance is less politically costly than Polgár's refusal is the immediate open question. The international press does not yet have an answer.",
  "sources": [
    {"bucket": "israel", "url": "https://www.haaretz.com/world-news/europe/2026-07-21/ty-article/jewish-hungarian-chess-legend-judit-polgar-turns-down-offer-for-presidency/0000019f-838d-d490-a59f-a7fdeb780000", "outlet": "Haaretz"},
    {"bucket": "uk", "url": "https://www.theguardian.com/world/2026/jul/20/peter-magyar-judit-polgar-president-hungary-chess-prodigy-strategic-move", "outlet": "The Guardian World"},
    {"bucket": "balkans", "url": "https://balkaninsight.com/2026/07/21/hungarian-pms-presidential-gambit-fails-as-polgar-declines-nomination/rd/", "outlet": "Balkan Insight"},
    {"bucket": "taiwan_hk", "url": "https://www.scmp.com/news/world/europe/article/3361262/chess-champion-judit-polgar-rejects-offer-become-hungarys-president", "outlet": "South China Morning Post"},
    {"bucket": "canada", "url": "https://www.theglobeandmail.com/world/article-hungary-pm-magyar-president-chess-judit-polgar/", "outlet": "Globe and Mail"},
    {"bucket": "china", "url": "https://news.cgtn.com/news/2026-07-20/Hungarian-PM-taps-chess-grandmaster-Judit-Polgar-to-serve-as-president-1OWjF3Rob8Q/p.html", "outlet": "CGTN World"},
    {"bucket": "israel", "url": "https://www.haaretz.com/world-news/europe/2026-07-20/ty-article/hungarys-pm-magyar-to-offer-presidency-to-jewish-chess-legend-judit-polgar/0000019f-7f81-d48b-ab9f-7faf12610000", "outlet": "Haaretz"},
    {"bucket": "hungary_central", "url": "https://hungarytoday.hu/no-pm-magyar-left-red-faced-after-rejection-from-his-presidential-choice/", "outlet": "Hungary Today"}
  ],
  "tags": ["hungary", "magyar", "polgar", "eu-politics", "framing-analysis"],
  "generated_at": "2026-07-22T10:31:46Z",
  "model": "claude-sonnet-4-6"
}
