{
  "meta_version": "10.0.3",
  "story_key": "L03cfbffd10",
  "date": "2026-07-25",
  "title": "The $950 Billion AI Deal Framed as a Geopolitical Declaration",
  "subtitle": "South Korean outlets treated the chipmaker partnerships as supply chain positioning; the only US non-wire outlet talked about electricity bills",
  "body_md": "South Korean President Lee Jae Myung traveled to San Francisco and signed $950 billion in partnership agreements between SK Hynix, Samsung Electronics, and major US tech companies including Nvidia. The headline number is large enough to describe the deal in purely financial terms. South Korean and regional outlets chose not to: they framed the agreements as geopolitical positioning, with Lee explicitly claiming South Korea's status as an \"irreplaceable, core nation in the AI supply chain.\"\n\n[Channel News Asia](https://www.channelnewsasia.com/business/south-koreas-sk-hynix-samsung-elec-sign-950-billion-partnership-us-big-tech-6277651) ran the headline numbers: \"South Korea's SK Hynix, Samsung Elec sign $950 billion partnership with US big tech.\" [Yonhap News](https://en.yna.co.kr/view/AEN20260725001153315) — South Korea's state wire — framed the visit through Lee's own declaration: \"South Korea will make a leap forward to become an irreplaceable, core nation in the AI supply chain.\" That phrase — \"irreplaceable, core nation\" — is the \"San Francisco AI Declaration\" that Lee issued as an explicit statement of strategic positioning. It names China without naming China: an irreplaceable supply chain partner, in current geopolitical terms, is one that cannot be substituted with Chinese alternatives.\n\n[Daily Caller](https://dailycaller.com/2026/07/24/trump-ai-data-centers-pledge-electricity-bills-down), the only US non-wire outlet in the corpus, covered the same agreements through Trump's domestic policy lens: AI data center investments would make power bills \"actually come down.\" The framing strip-mines the geopolitical content entirely. A story that South Korean outlets covered as a landmark in non-Chinese AI supply chain construction became, in the one US conservative outlet that ran it, a story about consumer electricity costs. Both frames are plausibly derived from the same facts; only one of them is operating at the scale the deal actually represents.\n\n[NK News](https://www.nknews.org/2026/07/lee-calls-on-mongolia-to-play-greater-role-in-spurring-dialogue-with-north-korea/) covered Lee's San Francisco trip entirely through the inter-Korean lens, reporting Lee's call for Mongolia to \"play a greater role in spurring dialogue with North Korea\" — a piece of the trip that all other outlets ignored. From the North Korea coverage perspective, Lee's overseas travel is primarily meaningful as an opportunity to advance dialogue with Pyongyang. The $950 billion in chip deals registered as background.\n\nJapan and China are both absent from this corpus. Japan's chipmakers — Samsung and SK Hynix compete directly with Japanese memory manufacturers — have direct commercial stakes in the partnership's terms. Their silence may reflect a judgment that the story is primarily about Korean-American industrial alignment rather than regional competition. China's absence is more significant: a US-South Korea partnership explicitly aimed at cementing non-Chinese AI supply chains is a strategic signal that Beijing has every reason to track and editorially counter. The absence suggests Chinese state media chose not to amplify a story that validates the logic of supply chain decoupling.\n\nThe \"irreplaceable, core nation\" framing that Lee used is worth sitting with. It is not a commercial claim — it is a security claim. It asserts that South Korea's chipmaking capacity is so embedded in the global AI production system that no alternative exists. That claim, if accurate, gives South Korea a form of geopolitical leverage that transcends bilateral trade relationships. Whether the $950 billion in partnership agreements actually creates that dependency, or whether it merely signals intent, is a question the coverage does not resolve. What it establishes is that Seoul is now making the argument explicitly and publicly.\n\nThe NK News framing — reading a $950 billion tech partnership primarily through the North Korea dialogue lens — is not as disconnected from the main story as it appears. Lee's stated goal of using his San Francisco visit to build diplomatic capital for inter-Korean dialogue is part of the same geopolitical calculus that produced the AI supply chain declaration. A South Korea that is \"irreplaceable\" in US AI infrastructure has more leverage in every bilateral relationship, including with Pyongyang's backers in Beijing and Moscow. The chip deals and the North Korea outreach are not separate stories; they are the same story about a middle power positioning itself for maximum strategic optionality.",
  "sources": [
    {
      "bucket": "vietnam_thai_my",
      "url": "https://www.channelnewsasia.com/business/south-koreas-sk-hynix-samsung-elec-sign-950-billion-partnership-us-big-tech-6277651",
      "outlet": "Channel News Asia"
    },
    {
      "bucket": "south_korea",
      "url": "https://en.yna.co.kr/view/AEN20260725001153315",
      "outlet": "Yonhap News"
    },
    {
      "bucket": "usa",
      "url": "https://dailycaller.com/2026/07/24/trump-ai-data-centers-pledge-electricity-bills-down",
      "outlet": "Daily Caller"
    },
    {
      "bucket": "korea_north",
      "url": "https://www.nknews.org/2026/07/lee-calls-on-mongolia-to-play-greater-role-in-spurring-dialogue-with-north-korea/",
      "outlet": "NK News"
    }
  ],
  "tags": [
    "south-korea",
    "ai",
    "chips",
    "supply-chain",
    "geopolitics",
    "framing-analysis"
  ],
  "generated_at": "2026-07-29T10:45:00Z",
  "model": "claude-sonnet-4-6"
}