{
  "meta_version": "10.0.3",
  "story_key": "Le8d2adc19b",
  "date": "2026-07-17",
  "title": "Japan's First Female Prime Minister Is Among the Loudest Opponents of a Female Emperor",
  "subtitle": "Japan revised its imperial succession law — and NPR was the only outlet to report who is blocking the next step",
  "body_md": "Japan's parliament enacted revised imperial succession rules on Friday, allowing male distant relatives to be adopted back into the imperial family and women to retain royal status after marrying commoners. What the law did not do is permit a female emperor — the change most opinion polls suggest a majority of Japanese citizens support. [AFP/France 24](https://www.france24.com/en/asia-pacific/20260717-japan-imperial-succession-law-female-emperor-ban) reported the revision's scope precisely: \"Japan changes imperial succession law but keeps ban on female emperor.\"\n\nAcross 13 articles from 13 outlets in 10 countries, coverage converged almost entirely on a single framing: procedural adjustment to preserve a shrinking male dynasty, insufficient to resolve the underlying succession problem. [South China Morning Post](https://www.scmp.com/news/asia/east-asia/article/3360871/japan-changes-rules-save-shrinking-monarchy-bars-female-emperors?utm_source=rss_feed) characterised it as Japan choosing to \"save a shrinking monarchy\" while \"barring female emperors.\" [BBC World](https://www.bbc.co.uk/news/articles/cy07rz79zg9o?at_medium=RSS&at_campaign=rss) reported the adoption provision — male distant relatives aged over 15 can now rejoin the imperial family — as a mechanism to extend the male line without addressing its root constraint.\n\nThe revision was described by [Anadolu Agency](https://www.aa.com.tr/en/asia-pacific/japan-retains-male-only-imperial-succession-in-1st-revised-law-since-1947/4001085) as the first change to imperial succession law since 1947 — nearly eighty years without amendment, now amended in a way that reinforces rather than revises the underlying structure. The emperor's teenage nephew, Prince Hisahito, will remain the primary heir under the revised law; [The Hindu](https://www.thehindu.com/news/international/japan-enacts-revised-law-that-strengthens-male-only-succession-to-lead-shrinking-imperial-family/article71232808.ece) noted this explicitly, framing the law as one that \"strengthens male-only succession\" rather than softening it. The current emperor has two daughters and a sister; none can inherit.\n\nThe one piece of political reporting that does not appear in international coverage — outside the U.S. — was filed by [NPR](https://www.npr.org/2026/07/17/g-s1-133536/japan-law-male-heirs-imperial-throne). NPR reported that Japan's first female Prime Minister, Sanae Takaichi, is among the strongest institutional opponents of female succession to the throne. The irony is structurally clean: the highest-ranking woman in Japan's executive branch is actively blocking the institutional path that would allow women to hold the country's most ceremonial office. NPR named the critics, quoted them, and placed Takaichi's position within the broader conservative coalition that has held the succession question closed for decades. No other international outlet in this corpus provided that political context.\n\n[Folha de São Paulo](https://redir.folha.com.br/redir/online/mundo/rss091/*https://www1.folha.uol.com.br/mundo/2026/07/japao-aprova-mudancas-na-sucessao-imperial-mas-nao-permite-imperatriz.shtml) noted, concisely, that the reform passed despite opinion polling suggesting majority Japanese support for allowing female emperors — \"apesar de as pesquisas sugerirem que essa medida\" had public backing. Brazilian coverage thus identified the democratic gap: parliamentary outcome and public preference running in opposite directions. No outlet in the corpus explored why that gap exists or who maintains it. NPR's Takaichi reporting is the closest any outlet came to an answer.\n\nSouth Korea's absence from this corpus is the pointed silence. Korean outlets were not in the cluster despite the country's historically charged relationship with Japan's imperial institution. The Japanese imperial system carries specific historical weight in South Korea — the colonial period, the comfort women question, the ongoing diplomatic tensions around historical acknowledgment — that gives a revision to imperial succession law a different valence in Seoul than in Berlin or São Paulo. Korean editorial silence may reflect a principled choice not to engage with Japanese imperial politics, or it may reflect a different news day. Either way, the angle is absent.\n\nThe pairwise similarity between Japan and the U.S. coverage was 0.542 — the lowest in the corpus — reflecting how much more domestic specificity NPR introduced compared to the wire-service framing Japanese outlets themselves favored. Japan's own press covered the law's technical provisions. NPR covered the political actors preserving them. Both are correct. They are not the same story.",
  "sources": [
    {"bucket": "wire_services", "url": "https://www.france24.com/en/asia-pacific/20260717-japan-imperial-succession-law-female-emperor-ban", "outlet": "AFP / France 24 EN"},
    {"bucket": "taiwan_hk", "url": "https://www.scmp.com/news/asia/east-asia/article/3360871/japan-changes-rules-save-shrinking-monarchy-bars-female-emperors?utm_source=rss_feed", "outlet": "South China Morning Post"},
    {"bucket": "uk", "url": "https://www.bbc.co.uk/news/articles/cy07rz79zg9o?at_medium=RSS&at_campaign=rss", "outlet": "BBC World"},
    {"bucket": "turkey", "url": "https://www.aa.com.tr/en/asia-pacific/japan-retains-male-only-imperial-succession-in-1st-revised-law-since-1947/4001085", "outlet": "Anadolu Agency English"},
    {"bucket": "india", "url": "https://www.thehindu.com/news/international/japan-enacts-revised-law-that-strengthens-male-only-succession-to-lead-shrinking-imperial-family/article71232808.ece", "outlet": "The Hindu Intl"},
    {"bucket": "usa", "url": "https://www.npr.org/2026/07/17/g-s1-133536/japan-law-male-heirs-imperial-throne", "outlet": "NPR World"},
    {"bucket": "brazil", "url": "https://redir.folha.com.br/redir/online/mundo/rss091/*https://www1.folha.uol.com.br/mundo/2026/07/japao-aprova-mudancas-na-sucessao-imperial-mas-nao-permite-imperatriz.shtml", "outlet": "Folha de São Paulo"}
  ],
  "tags": ["japan", "imperial-succession", "female-emperor", "takaichi", "framing-analysis", "silence"],
  "generated_at": "2026-07-18T09:54:37Z",
  "model": "claude-sonnet-4-6"
}
